{
  "$schema": "https://json-schema.org/draft/2020-12/schema",
  "$id": "https://canonicalmodel.internal/contracts/C5/AttributeRecord/1.0.json",
  "title": "C5 AttributeRecord",
  "description": "Transcribed from Section 3.3. The pivot contract of the platform: normalized representation of a single attribute from source materials, with provenance (evidenceRefs) mandatory per invariant I1.",
  "type": "object",
  "additionalProperties": false,
  "required": [
    "attributeId", "runId", "region", "sourceContract", "path", "localName",
    "dataType", "cardinality", "obligation", "evidenceTier", "inferred", "evidenceRefs"
  ],
  "properties": {
    "attributeId": { "$ref": "../../common/defs.json#/$defs/attrId" },
    "runId": { "$ref": "../../common/defs.json#/$defs/uuid" },
    "region": { "$ref": "../../common/defs.json#/$defs/region" },
    "sourceContract": { "type": "string", "description": "artefactId of the CorpusManifest artefact this was extracted from." },
    "path": { "type": "string", "description": "Dot-delimited normalised path within the source." },
    "localName": { "type": "string" },
    "dataType": { "$ref": "../../common/defs.json#/$defs/dataType" },
    "typeDetail": {
      "type": "object",
      "additionalProperties": false,
      "description": "Tightened at Increment 3 (parsers/type_normalisation.py, Section 4.3/4.4). One shape shared across all dataTypes; every sub-field is optional and only populated by the parser idiom that produces it - see docs/contracts.md's typeDetail table.",
      "properties": {
        "bits": { "type": "integer", "description": "integer: xs:int(32)/xs:long(64)/Avro int(32)/long(64) bit width." },
        "offsetRequired": { "type": "boolean", "description": "dateTime: whether the source format mandates a UTC offset." },
        "refTarget": { "type": "string", "description": "reference: the target this reference points to (xs:IDREF target, $ref pointer, Avro named-type reference)." },
        "choiceGroup": { "type": "string", "description": "xs:choice: shared identifier for every branch of one choice group (Section 4.4)." },
        "substitutionHead": { "type": "boolean", "description": "true on the head element of an XSD substitution group." },
        "substitutionOf": { "type": "string", "description": "On a substitution-group member: the attributeId of the head element it substitutes for." },
        "explicitNull": { "type": "boolean", "description": "XSD nillable=\"true\". MUST NOT be conflated with cardinality's 0..1 (minOccurs=\"0\")." },
        "inheritedFrom": { "type": "string", "description": "xs:extension: the base type localName this attribute was flattened in from, when the region did not declare it directly." }
      }
    },
    "cardinality": { "$ref": "../../common/defs.json#/$defs/cardinality" },
    "obligation": { "$ref": "../../common/defs.json#/$defs/obligation" },
    "enumeration": {
      "type": "array",
      "items": {
        "type": "object",
        "additionalProperties": false,
        "required": ["value"],
        "properties": {
          "value": { "type": "string" },
          "meaning": { "type": "string" },
          "source": { "type": "string", "enum": ["declared", "documented", "observed"] }
        }
      }
    },
    "constraints": {
      "type": "array",
      "items": {
        "type": "object",
        "additionalProperties": false,
        "required": ["kind", "expression"],
        "properties": {
          "kind": {
            "type": "string",
            "enum": ["length", "pattern", "range", "format", "crossField", "custom"]
          },
          "expression": { "type": "string" },
          "source": { "type": "string", "enum": ["schema", "code", "documentation"] }
        }
      }
    },
    "semantics": {
      "type": "object",
      "additionalProperties": false,
      "properties": {
        "description": { "type": "string" },
        "glossaryRefs": { "type": "array", "items": { "type": "string" } },
        "ruleStatements": { "type": "array", "items": { "type": "string" } }
      }
    },
    "parentPath": { "type": ["string", "null"] },
    "siblingCount": { "type": "integer", "minimum": 0 },
    "evidenceTier": { "$ref": "../../common/defs.json#/$defs/evidenceTier" },
    "inferred": { "type": "boolean" },
    "evidenceRefs": {
      "type": "array",
      "minItems": 1,
      "items": { "$ref": "../../common/defs.json#/$defs/evidenceRef" },
      "description": "Invariant I1: non-empty and every reference MUST resolve to an artefact listed in the run's CorpusManifest (cross-document; see contracts/validators.py:check_i1_evidence_resolvable)."
    },
    "confidence": { "type": "number", "minimum": 0, "maximum": 1 },
    "producedBy": {
      "type": "object",
      "additionalProperties": false,
      "properties": {
        "stage": { "const": "S3" },
        "agent": { "type": "string" },
        "toolVersion": { "type": "string" }
      }
    }
  }
}
