{
  "attributeId": "attr://us/art-claims-openapi-us/claim.claimDate",
  "runId": "11111111-1111-1111-1111-111111111111",
  "region": "us",
  "sourceContract": "art-claims-openapi-us",
  "path": "claim.claimDate",
  "localName": "claimDate",
  "dataType": "date",
  "cardinality": "1..1",
  "obligation": { "level": "mandatory" },
  "evidenceTier": 1,
  "inferred": false,
  "evidenceRefs": ["evref://us/git/art-claims-openapi-us@042896dc1966b8a6#/paths/~1claims/get/responses/200/claimDate"],
  "confidence": 0.98,
  "producedBy": { "stage": "S3", "agent": "openapi-parser", "toolVersion": "1.0.0" }
}
