[
  {
    "attributeId": "attr://uk/art-claims-uk-v3/ClaimHeader.ClaimNo",
    "runId": "b0f2e7c4-9a11-4d2e-8f30-6c5b7d1e2a44",
    "region": "uk",
    "sourceContract": "art-claims-uk-v3",
    "path": "ClaimHeader.ClaimNo",
    "localName": "ClaimNo",
    "dataType": "string",
    "cardinality": "1..1",
    "obligation": { "level": "mandatory" },
    "evidenceTier": 1,
    "inferred": false,
    "evidenceRefs": ["evref://uk/git/claims-api-openapi@3f9a1c22b0d47e58#/components/schemas/ClaimHeader/properties/ClaimNo"]
  },
  {
    "attributeId": "attr://uk/art-claims-uk-v3/ClaimHeader.LossDate",
    "runId": "b0f2e7c4-9a11-4d2e-8f30-6c5b7d1e2a44",
    "region": "uk",
    "sourceContract": "art-claims-uk-v3",
    "path": "ClaimHeader.LossDate",
    "localName": "LossDate",
    "dataType": "date",
    "cardinality": "1..1",
    "obligation": { "level": "mandatory" },
    "evidenceTier": 1,
    "inferred": false,
    "evidenceRefs": ["evref://uk/git/claims-api-openapi@3f9a1c22b0d47e58#/components/schemas/ClaimHeader/properties/LossDate"]
  },
  {
    "attributeId": "attr://uk/art-claims-uk-v3/ClaimHeader.StatusCd",
    "runId": "b0f2e7c4-9a11-4d2e-8f30-6c5b7d1e2a44",
    "region": "uk",
    "sourceContract": "art-claims-uk-v3",
    "path": "ClaimHeader.StatusCd",
    "localName": "StatusCd",
    "dataType": "string",
    "cardinality": "1..1",
    "obligation": { "level": "mandatory" },
    "enumeration": [
      { "value": "NEW" }, { "value": "OPN" }, { "value": "RPN" }, { "value": "STL" },
      { "value": "CLS" }, { "value": "DEC" }, { "value": "WDR" }
    ],
    "evidenceTier": 1,
    "inferred": false,
    "evidenceRefs": ["evref://uk/git/claims-api-openapi@3f9a1c22b0d47e58#/components/schemas/ClaimHeader/properties/StatusCd"]
  },
  {
    "attributeId": "attr://uk/art-claims-uk-v3/Cover.LimitAmount",
    "runId": "b0f2e7c4-9a11-4d2e-8f30-6c5b7d1e2a44",
    "region": "uk",
    "sourceContract": "art-claims-uk-v3",
    "path": "Cover.LimitAmount",
    "localName": "LimitAmount",
    "dataType": "decimal",
    "cardinality": "0..1",
    "obligation": { "level": "optional" },
    "evidenceTier": 1,
    "inferred": false,
    "evidenceRefs": ["evref://uk/git/claims-api-openapi@3f9a1c22b0d47e58#/components/schemas/Cover/properties/LimitAmount"]
  },
  {
    "attributeId": "attr://uk/art-claims-uk-v3/ClaimDetail.MOJRef",
    "runId": "b0f2e7c4-9a11-4d2e-8f30-6c5b7d1e2a44",
    "region": "uk",
    "sourceContract": "art-claims-uk-v3",
    "path": "ClaimDetail.MOJRef",
    "localName": "MOJRef",
    "dataType": "string",
    "cardinality": "0..1",
    "obligation": { "level": "optional" },
    "evidenceTier": 1,
    "inferred": false,
    "evidenceRefs": ["evref://uk/git/claims-api-openapi@3f9a1c22b0d47e58#/components/schemas/ClaimDetail/properties/MOJRef"]
  },
  {
    "attributeId": "attr://uk/art-claims-uk-v3/ClaimHeader.LegacyBatchId",
    "runId": "b0f2e7c4-9a11-4d2e-8f30-6c5b7d1e2a44",
    "region": "uk",
    "sourceContract": "art-claims-uk-v3",
    "path": "ClaimHeader.LegacyBatchId",
    "localName": "LegacyBatchId",
    "dataType": "string",
    "cardinality": "0..1",
    "obligation": { "level": "optional" },
    "evidenceTier": 1,
    "inferred": false,
    "evidenceRefs": ["evref://uk/git/claims-api-openapi@3f9a1c22b0d47e58#/components/schemas/ClaimHeader/properties/LegacyBatchId"]
  },
  {
    "attributeId": "attr://uk/art-claims-uk-v3/ClaimDetail.HandlerNotes",
    "runId": "b0f2e7c4-9a11-4d2e-8f30-6c5b7d1e2a44",
    "region": "uk",
    "sourceContract": "art-claims-uk-v3",
    "path": "ClaimDetail.HandlerNotes",
    "localName": "HandlerNotes",
    "dataType": "string",
    "cardinality": "0..1",
    "obligation": { "level": "optional" },
    "evidenceTier": 1,
    "inferred": false,
    "evidenceRefs": ["evref://uk/git/claims-api-openapi@3f9a1c22b0d47e58#/components/schemas/ClaimDetail/properties/HandlerNotes"]
  }
]
